<?xml version="1.0" encoding="iso-8859-1"?>
<!DOCTYPE XMLlist SYSTEM "../XMLlist.dtd" [<!ENTITY nbsp "&amp;nbsp;">]>

<!-- messages localisés en français pour le module Article
****************************************************************************************
© 2002-2012 PMB Services / www.sigb.net pmb@sigb.net et contributeurs (voir www.sigb.net)
****************************************************************************************
$Id: cms_module_carousel_view_carousel.xml,v 1.2 2016-09-20 10:25:42 apetithomme Exp $ -->

<XMLlist>
	<entry code='cms_module_carousel_view_carousel_mode'>Display mode</entry>
	<entry code='cms_module_carousel_view_carousel'>Carousel</entry>
	<entry code='cms_module_carousel_view_carousel_mode_horizontal'>Horizontal</entry>
	<entry code='cms_module_carousel_view_carousel_mode_vertical'>Vertical</entry>
	<entry code='cms_module_carousel_view_carousel_mode_fade'>Fade</entry>
	<entry code='cms_module_carousel_view_carousel_speed'>Transition time (in ms)</entry>
	<entry code='cms_module_carousel_view_carousel_pause'>Pause time (in ms)</entry>
	<entry code='cms_module_carousel_view_carousel_display_quantity'>Number of elements per page</entry>
	<entry code='cms_module_carousel_view_carousel_slide_quantity'>Number of elements moved</entry>
	<entry code='cms_module_carousel_view_carousel_autostart'>Automatic start</entry>
	<entry code='cms_module_carousel_view_carousel_autohover'>Pause when hovering</entry>
	<entry code='cms_module_carousel_view_carousel_pager'>Display of the links towards the elements</entry>
	<entry code='cms_module_carousel_view_carousel_yes'>Yes</entry>
	<entry code='cms_module_carousel_view_carousel_no'>No</entry>
	<entry code='cms_module_carousel_manage_default_css'>CSS to apply by default</entry>
	<entry code='cms_module_carousel_view_template_item'>Template of an item</entry>
	<entry code='cms_module_carousel_view_carousel_css'>Linked CSS</entry>
	<entry code='cms_module_carousel_view_carousel_id_desc'>Identifier of the frame</entry>
	<entry code='cms_module_carousel_view_carousel_record_content_desc'>Final appearance of a record template</entry>
	<entry code='cms_module_common_view_django_template_record_content'>Record template to use for the content</entry>
</XMLlist>