<?xml version="1.0" encoding="iso-8859-1"?>
<!DOCTYPE XMLlist SYSTEM "../XMLlist.dtd" [<!ENTITY nbsp "&amp;nbsp;">]>

<!-- messages localisés en français pour la classe datasource
****************************************************************************************
© 2002-2012 PMB Services / www.sigb.net pmb@sigb.net et contributeurs (voir www.sigb.net)
****************************************************************************************
$Id: cms_module_itemslist_view_django_by_tags.xml,v 1.1 2015-10-13 07:42:56 dgoron Exp $ -->

<XMLlist>
	<entry code="cms_module_itemslist_view_django_build_item_link">Construction du lien vers un item</entry>
	<entry code="cms_module_itemslist_view_django_by_tags_item_link_desc">Lien vers l'item</entry>
	<entry code="cms_module_itemslist_view_django_build_tag_link">Construction du lien vers un tag</entry>
	<entry code="cms_module_itemslist_view_django_by_tags_tag_link_desc">Lien vers le tag</entry>
	<entry code="cms_module_itemslist_view_django_by_tags_tags_desc">Tableau des tags</entry>
	<entry code="cms_module_itemslist_view_django_by_tags_tags_id_desc">Identifiant du tag</entry>
	<entry code="cms_module_itemslist_view_django_by_tags_tags_label_desc">Libellé du tag</entry>
	<entry code="cms_module_itemslist_view_django_by_tags_tags_items_desc">Tableau des items associés à ce tag</entry>
</XMLlist>