<?xml version="1.0" encoding="iso-8859-1"?>
<!DOCTYPE XMLlist SYSTEM "../XMLlist.dtd" [<!ENTITY nbsp "&amp;nbsp;">]>

<!-- messages localisés en français pour le connecteur LastFM
****************************************************************************************
© 2002-2007 PMB Services / www.sigb.net pmb@sigb.net et contributeurs (voir www.sigb.net)
****************************************************************************************
$Id: en_UK.xml,v 1.1 2015-06-15 12:55:35 pmbs Exp $ -->

<XMLlist>
	<entry code="lastfm">LastFM</entry>
	<entry code="lastfm_callback_url">URL to fill in in Callback URL when registering on LastFM</entry>
	<entry code="lastfm_api_key">API key</entry>
	<entry code="lastfm_secret_key">Secret key</entry>
	<entry code="lastfm_no_source">First save the source to have the URL!</entry>
	<entry code="lastfm_token">Allow the application on LastFM</entry>
	<entry code="lastfm_link_allow_ws">Click to allow</entry>
	<entry code="lastfm_ws_allow_in_progress">You have to save the source to validate</entry>
	<entry code="lastfm_ws_allowed">Allowed</entry>
	<entry code="lastfm_allow_need_api_key">You have to fill in the keys before asking for the authorization</entry>
	<entry code="lastfm_enrichment_source">(enrichment from Last FM)</entry>
	<entry code="lastfm_see_picture">See the image on LastFM</entry>
	<entry code="lastfm_no_informations">No information in available.</entry>
</XMLlist>