<?xml version="1.0" encoding="iso-8859-1"?>
<!DOCTYPE XMLlist SYSTEM "../XMLlist.dtd" [<!ENTITY nbsp "&amp;nbsp;">]>

<!-- messages localisés en français pour le module Article
****************************************************************************************
© 2002-2012 PMB Services / www.sigb.net pmb@sigb.net et contributeurs (voir www.sigb.net)
****************************************************************************************
$Id: cms_module_watcheslist_selector_watches_generic.xml,v 1.1 2015-06-15 12:55:33 pmbs Exp $ -->

<XMLlist>
	<entry code="cms_module_common_selector_sub_choice_label">Selection of watches</entry>
	<entry code="cms_module_watcheslist_selector_watches">Manual selection</entry>
	<entry code="cms_module_common_selector_env_var">Selection through an environment label</entry>
	<entry code="cms_module_common_selector_type_article_generic">Selection a generic field</entry>	
	<entry code="cms_module_common_selector_type_article">Selection trhough a field of an article's content type</entry>	
	<entry code="cms_module_common_selector_type_section_generic">Selection through a generic field of a rubric</entry>	
	<entry code="cms_module_common_selector_type_section">Selection through a field of a rubric's content type</entry>	
	<entry code='cms_module_watcheslist_selector_watches_by_categories'>Selection by sortings</entry>
</XMLlist>