<?xml version="1.0" encoding="iso-8859-1"?>
<!DOCTYPE XMLlist SYSTEM "../XMLlist.dtd" [<!ENTITY nbsp "&amp;nbsp;">]>

<!-- messages localisés en français pour la gestion des droits d'accès Emprunteurs Notices
****************************************************************************************
© 2002-2007 PMB Services / www.sigb.net pmb@sigb.net et contributeurs (voir www.sigb.net)
****************************************************************************************
$Id: en_UK.xml,v 1.4 2015-06-26 08:49:44 pmbs Exp $ -->

<XMLlist>
	<entry code="long_name">Borrowers' access rights - Digital documents</entry>
	<entry code="menu_name">Borrowers - Digital documents</entry>
	<entry code="user_prf_lib">Borrowers roles</entry>
	<entry code="user_prf_bt_add">Add a role</entry>
	<entry code="user_prf_bt_calc">Automatic calculation of the roles</entry>
	<entry code="user_prf_calc_list_lib">Calculated borrowers roles</entry>
	<entry code="user_prf_used_list_lib">Established borrowers roles</entry>
	<entry code="user_prf_unused_list_lib">Previous borrowers roles to reassign</entry>
	<entry code="user_prf_calc_lib">Borrower role</entry>
	<entry code="user_prf_def_lib">Default borrower role (not precised)</entry>
	
	<entry code="res_prf_lib">Digital documents profiles</entry>
	<entry code="res_prf_bt_add">Add a profile</entry>
	<entry code="res_prf_bt_calc">Automatic calculation of the profiles</entry>
	<entry code="res_prf_calc_list_lib">Digital documents profiles calculated</entry>
	<entry code="res_prf_used_list_lib">Digital documents profiles established</entry>
	<entry code="res_prf_unused_list_lib">Previous digital documents profiles to reassign</entry>
	<entry code="res_prf_calc_lib">Digital document profile</entry>
	<entry code="res_prf_def_lib">Default digital document profile (not precised)</entry>
	
	<entry code="dom_mod_rights">Modify the digital document access rights</entry> 
	<entry code="dom_mod_pro">Modify the digital document profile</entry>
	
	<entry code="view_docnum_opac">Reading in viewer</entry>
	<entry code="download_docnum_opac">Download</entry>
	<entry code="show_docnum_opac">Visible in the record</entry>

	<entry code="override">Borrowers access rights overridden - Digital documents</entry>
	<entry code="override_none">Do nothing</entry>
	<entry code="override_yes">Override</entry>
	<entry code="override_no">Delete</entry>
	<entry code="dom_override_rights">Allow the overriding of the access rights in the borrower's record</entry>
</XMLlist>